source,title,url,snippet,published_date,query,year,extracted,extraction_status
DAWN,HBL chief tapped for incoming finance team - Business,https://www.dawn.com/news/1819486,"ISLAMABAD: The chief executive officer of Habib Bank Ltd (HBL), Pakistan's largest bank, is likely to be tapped for a top position in the finance team of ...",Not Found,HBL_STRICT,2024,"March 6, 2024",SUCCESS
DAWN,HBL Pakistan Super League: Sultans hold nerve in thriller ...,https://www.dawn.com/news/1815877,"HBL Pakistan Super League: Sultans hold nerve in thriller to edge United · Dawn Report Published February 21, 2024. 0.",Not Found,HBL_STRICT,2024,"February 21, 2024",SUCCESS
DAWN,HBL PSL 2024: Ton-up Usman leads rampant Sultans into ...,https://www.dawn.com/news/1818890,"Bludgeoning the Karachi bowlers for his second HBL Pakistan Super League century, Usman reminded what Pakistan missed out on as he took the Sultans to a 20-run ...",Not Found,HBL_STRICT,2024,"March 4, 2024",SUCCESS
DAWN,HBL PSL 2024: Sultans look to break curse as United eye ...,https://www.dawn.com/news/1822126,The ninth edition of the HBL Pakistan Super League is set to culminate in a title-deciding clash between a side for which finals have been a curse lately.,Not Found,HBL_STRICT,2024,"March 18, 2024",SUCCESS
DAWN,"HBL PSL 2024: Babar, Saim take Zalmi into playoffs - Sport",https://www.dawn.com/news/1820150,"RAWALPINDI: Peshawar Zalmi skipper Babar Azam drives during the HBL Pakistan ... HBL Pakistan Super League match. The former Pakistan skipper, like he mostly ...",Not Found,HBL_STRICT,2024,"March 9, 2024",SUCCESS
DAWN,What are the challenges that await the new finance minister?,https://www.dawn.com/news/1820971,"Muhammad Aurangzeb, a former chief executive of Habib Bank Limited (HBL) with extensive experience in the financial sector, has taken the reins as Pakistan's ...",Not Found,HBL_STRICT,2024,"March 13, 2024",SUCCESS
DAWN,HBL PSL 2025: Khurram-inspired Quetta Gladiators blow ...,https://www.dawn.com/news/1907410,"HBL Pakistan Super League: Mitchell, Raza star as Qalandars deepen Sultans' woes ...",Not Found,HBL_STRICT,2025,"April 30, 2025",SUCCESS
DAWN,HBL PSL 2024: Malik holds nerve to keep Karachi Kings ...,https://www.dawn.com/news/1820424,... HBL Pakistan Super League match against Lahore Qalandars at the National Bank Stadium on Saturday. —Tahir Jamal/White Star. Jump to comments. Join our ...,Not Found,HBL_STRICT,2024,"March 10, 2024",SUCCESS
DAWN,HBL PSL 2024: Sultans eye first win against Zalmi in high- ...,https://www.dawn.com/news/1821306,KARACHI: Multan Sultans have done well enough to deserve the top spot in the HBL Pakistan Super League standings by the end of the tournament's round-robin ...,Not Found,HBL_STRICT,2024,"March 14, 2024",SUCCESS
DAWN,BISP signs agreements with six banks to facilitate ...,https://www.dawn.com/news/1816113,"... Habib Bank Limited (HBL), and HBL Microfinance. BISP Chairperson Dr. Mohammad Amjad Saqib emphasised the importance of collective responsibility towards ...",Not Found,HBL_STRICT,2024,"February 22, 2024",SUCCESS
DAWN,"HBL PSL 2024: Usman, Usama pile on the misery for ...",https://www.dawn.com/news/1817625,"Playing their last game of the HBL Pakistan Super League on home turf, once again in front of a packed Gaddafi Stadium, skipper Shaheen Shah Afridi sent the ...",Not Found,HBL_STRICT,2024,"February 28, 2024",SUCCESS
DAWN,"Franchises, PCB all but agree over eight-team PSL, April- ...",https://www.dawn.com/news/1834150,"LAHORE: With two more teams set to be added to the HBL Pakistan Super League (PSL) in 2026, the current six franchises have all but agreed over the ...",Not Found,HBL_STRICT,2024,"May 18, 2024",SUCCESS
DAWN,Shadab leads Islamabad United to huge win over ...,https://www.dawn.com/news/1815095,HBL Pakistan Super League: Trophy unveiling stirs excitement ...,Not Found,HBL_STRICT,2024,"February 18, 2024",SUCCESS
DAWN,PCB finalises PSL player categories - Sport,https://www.dawn.com/news/1879409,"... HBL Pakistan Super League (PSL), the country's cricket board announced on Tuesday. The quartet, who previously belonged to the Diamond category, will now ...",Not Found,HBL_STRICT,2024,"December 18, 2024",SUCCESS
DAWN,"Dazzling fireworks, laser show open PSL 9 - Newspaper",https://www.dawn.com/news/1815067,LAHORE: A sparkling laser show and a colouful display of fireworks during an impressive ceremony marked the start of the ninth edition of the HBL Pakistan ...,Not Found,HBL_STRICT,2024,"February 18, 2024",SUCCESS
DAWN,PCB proposes April-May window for PSL 2025 to franchises,https://www.dawn.com/news/1831467,The Pakistan Cricket Board (PCB) on Saturday proposed to the franchises of the HBL Pakistan Super League to hold next year's edition of PSL from April 7 to May ...,Not Found,HBL_STRICT,2024,"May 5, 2024",SUCCESS
DAWN,Under-fire Zaka Ashraf leaves helm of Pakistan Cricket Board,https://www.dawn.com/news/1807242,"The committee granted approval to financial accounts and finalised the budget for the upcoming ninth edition of the HBL Pakistan Super League (PSL), set to ...",Not Found,HBL_STRICT,2024,"January 20, 2024",SUCCESS
DAWN,No guarantees Babar will play full New Zealand series ...,https://www.dawn.com/news/1827880,"Azhar, who recently won the HBL Pakistan Super League for Islamabad United as head coach, said that data suggested New Zealand — apparently depleted by the ...",Not Found,HBL_STRICT,2024,"April 17, 2024",SUCCESS
DAWN,Five 'Champion' teams to form top tier of revamped ...,https://www.dawn.com/news/1850433,"... HBL Pakistan Super League. The PCB, in its press release following their announcement, said the new competitions were meant to “bridge the gap between ...",Not Found,HBL_STRICT,2024,"August 6, 2024",SUCCESS
DAWN,'Pakistan comes first': Imad Wasim takes back retirement in ...,https://www.dawn.com/news/1823317,Wasim was part of Islamabad United who reached the HBL Pakistan Super League final to take the trophy on Monday night. He gave three match-winning ...,Not Found,HBL_STRICT,2024,"March 23, 2024",SUCCESS
DAWN,PSL players draft set for Jan 11 with IPL rejects on radar,https://www.dawn.com/news/1877999,"LAHORE: The player draft for the upcoming edition of the HBL Pakistan Super League (PSL) will take place on January 11, a Pakistan Cricket Board (PCB) ...",Not Found,HBL_STRICT,2024,"December 11, 2024",SUCCESS
DAWN,PSL 2024: Multan end Quetta's winning streak to sit atop ...,https://www.dawn.com/news/1817016,HBL Pakistan Super League: Sultans hold nerve in thriller to edge United ...,Not Found,HBL_STRICT,2024,"February 25, 2024",SUCCESS
DAWN,CRICKET: OLD SCHOOL AND THE SEA,https://www.dawn.com/news/1818746,"... HBL Pakistan Super League so far. The right-armer, who rose through the ranks by impressing with the red ball, has been as good with the white one in the ...",Not Found,HBL_STRICT,2024,"March 3, 2024",SUCCESS
DAWN,PCB announces 17-man squad for New Zealand T20I series,https://www.dawn.com/news/1826702,HBL Pakistan Super League: Record-breaking Rossouw lifts Sultans into playoffs.,Not Found,HBL_STRICT,2024,"April 9, 2024",SUCCESS
DAWN,Yasir confident Pakistan have all it takes to win New ...,https://www.dawn.com/news/1802743,... HBL Pakistan Super League despite putting up a decent show in the National T20 Cup.Yasir acknowledged Ahmed's recent performances and claimed that he urged ...,Not Found,HBL_STRICT,2024,"January 3, 2024",SUCCESS
DAWN,"FIA books 86 officials of Hesco, two banks for fraud in ...",https://www.dawn.com/news/1822988,... Habib Bank Limited on charges of embezzling more than Rs1 billion though fraud in Hesco's salaries fund account. FIA Composite Circle Shaheed Benazirabad's ...,Not Found,HBL_STRICT,2024,"March 22, 2024",SUCCESS
DAWN,Swiatek defeats Rybakina to capture third straight Qatar ...,https://www.dawn.com/news/1815292,HBL Pakistan Super League: Gladiators start with clash ...,Not Found,HBL_STRICT,2024,"February 19, 2024",SUCCESS
DAWN,"PCB announces PSL prize money, auction plan for new ...",https://www.dawn.com/news/1956591,LAHORE: Pakistan Cricket Board (PCB) chairman Mohsin Naqvi on Friday announced a new reward for the upcoming HBL Pakistan Super League (PSL) edition set to ...,Not Found,HBL_STRICT,2025,"November 22, 2025",SUCCESS
DAWN,"Mitchell, Raza star as Qalandars deepen Sultans' woes",https://www.dawn.com/news/1906769,"HBL Pakistan Super League: Mitchell, Raza star as Qalandars deepen Sultans' woes · Mohammad Yaqoob Published April 27, 2025. 0.",Not Found,HBL_STRICT,2025,"April 27, 2025",SUCCESS
DAWN,HBL Pakistan Super League - Newspaper,https://www.dawn.com/news/1911872,"HBL Pakistan Super League ... RAWALPINDI: Hasan Nawaz's unbeaten 67 off 38 balls, studded with six towering sixes, powered Quetta Gladiators to a thrilling two- ...",Not Found,HBL_STRICT,2025,"May 19, 2025",SUCCESS
DAWN,HBL Pakistan Super League: Raza stars as Qalandars end ...,https://www.dawn.com/news/1907723,"Imperious after winning their opening five games of the ongoing HBL Pakistan Super League season, they were routed by a rampant Lahore Qalandars at the Gaddafi ...",Not Found,HBL_STRICT,2025,"May 1, 2025",SUCCESS
DAWN,HBL PSL 2025 to continue as per schedule amid ...,https://www.dawn.com/news/1909144,"The Pakistan Cricket Board (PCB) confirmed on Wednesday that the HBL Pakistan Super League 2025 will continue as per schedule, amid escalating regional ...",Not Found,HBL_STRICT,2025,"May 7, 2025",SUCCESS
DAWN,HBL PSL 2025: Sultans' play-off hopes quashed by ...,https://www.dawn.com/news/1907862,Multan Sultans' desperate bid to keep their HBL Pakistan Super League play-off hopes alive ended in a crushing 87-run defeat to Karachi Kings on Thursday.,Not Found,HBL_STRICT,2025,"May 2, 2025",SUCCESS
DAWN,"HBL PSL: Shaheen, Fakhar inspire Lahore Qalandars to ...",https://www.dawn.com/news/1904104,"RAWALPINDI: After a poor start to their HBL Pakistan Super League campaign, Lahore Qalandars needed inspiration to stage a comeback.",Not Found,HBL_STRICT,2025,"April 14, 2025",SUCCESS
DAWN,"HBL PSL 2025: Fakhar, Shaheen star again as Lahore ...",https://www.dawn.com/news/1904530,"KARACHI: In the most anticipated HBL Pakistan Super league fixture here at the National Bank Stadium on Tuesday, Lahore Qalandars were as clinical as Karachi ...",Not Found,HBL_STRICT,2025,"April 16, 2025",SUCCESS
DAWN,HBL Pakistan Super League: Quetta Gladiators' fightback ...,https://www.dawn.com/news/1906627,"HBL Pakistan Super League: Quetta Gladiators' fightback floors Karachi Kings · Mohammad Yaqoob Published April 26, 2025. 0.",Not Found,HBL_STRICT,2025,"April 26, 2025",SUCCESS
DAWN,HBL Pakistan Super League: Holder stars as United crush ...,https://www.dawn.com/news/1903649,"HBL Pakistan Super League: Holder stars as United crush Qalandars in flying start to title defence · Kashif Abbasi Published April 12, 2025. 0.",Not Found,HBL_STRICT,2025,"April 12, 2025",SUCCESS
DAWN,HBL PSL 2025: United juggernaut rolls on with thumping ...,https://www.dawn.com/news/1906185,"And the most clinical side in the ongoing HBL Pakistan Super League edition so far, did what it has done all season; win matches. On Wednesday night here at ...",Not Found,HBL_STRICT,2025,"April 24, 2025",SUCCESS
DAWN,"HBL PSL 2025: Yasir, Ubaid star as Multan Sultans get off ...",https://www.dawn.com/news/1906017,MULTAN: All Multan Sultans needed to get off the mark in this HBL Pakistan Super League season was a homecoming. In their first match at the Multan Cricket ...,Not Found,HBL_STRICT,2025,"April 23, 2025",SUCCESS
DAWN,Former South African captain Faf du Plessis to play in PSL,https://www.dawn.com/news/1958291,LAHORE: South African former Test cricketer Faf du Plessis has confirmed he will play in the 11th edition of the HBL Pakistan Super League (PSL) in 2026 ...,Not Found,HBL_STRICT,2025,"November 30, 2025",SUCCESS
DAWN,'PCB to pay additional $100000 to elite PSL recruits' - Sport,https://www.dawn.com/news/1886421,"KARACHI: The Pakistan Cricket Board (PCB) will pay an additional sum of $100,000 to six high-profile foreign players in the HBL Pakistan Super League ...",Not Found,HBL_STRICT,2025,"January 20, 2025",SUCCESS
DAWN,PSL 10 to commence from April 11 as PCB unveils schedule,https://www.dawn.com/news/1894877,"The Pakistan Cricket Board (PCB) on Friday announced the schedule for the HBL Pakistan Super League X, set to commence from April 11.",Not Found,HBL_STRICT,2025,"February 28, 2025",SUCCESS
DAWN,"PSL 2025: Fakhar, Salman shine as Qalandars seal playoff ...",https://www.dawn.com/news/1911853,"Fakhar Zaman and Salman Mirza starred with the bat and ball, respectively, as Lahore Qalandars secured their place in the HBL Pakistan Super League playoffs.",Not Found,HBL_STRICT,2025,"May 19, 2025",SUCCESS
DAWN,Revised schedule unveiled as PSL 2025 resumes on ...,https://www.dawn.com/news/1910846,The Pakistan Cricket Board (PCB) on Tuesday announced the revised schedule for the remaining eight matches of the HBL Pakistan Super League (PSL) 2025.,Not Found,HBL_STRICT,2025,"May 14, 2025",SUCCESS
DAWN,Multan Sultans announce humanitarian initiative for Gaza ...,https://www.dawn.com/news/1903882,KARACHI: HBL Pakistan Super League franchise Multan Sultans have launched a humanitarian initiative to support children affected by the ongoing conflict in ...,Not Found,HBL_STRICT,2025,"April 13, 2025",SUCCESS
DAWN,PCB shifts tri-nation series to Lahore and Karachi,https://www.dawn.com/news/1884052,"The PCB's recent history has seen several significant alterations, including a last-minute shift in the venue for the HBL Pakistan Super League (PSL) player ...",Not Found,HBL_STRICT,2025,"January 9, 2025",SUCCESS
DAWN,Jason Holder's all-round show keeps Islamabad United ...,https://www.dawn.com/news/1904753,"Islamabad United continued their perfect run in the ongoing season of the HBL Pakistan Super League, thrashing Multan Sultans by 47 runs here at the Rawalpindi ...",Not Found,HBL_STRICT,2025,"April 17, 2025",SUCCESS
DAWN,Multan Sultans likely to opt for fresh bidding,https://www.dawn.com/news/1906180,HBL Pakistan Super League franchise Multan Sultans is expected to opt for fresh bidding instead of retaining the franchise under the existing policy.,Not Found,HBL_STRICT,2025,"April 24, 2025",SUCCESS
DAWN,South Africa's Corbin Bosch served legal notice by PCB,https://www.dawn.com/news/1898391,"The 30-year-old Bosch was picked by Peshawar Zalmi in the Diamond category during the 10th edition of the HBL Pakistan Super League Player Draft, held in Lahore ...",Not Found,HBL_STRICT,2025,"March 17, 2025",SUCCESS
DAWN,"HBL PSL 2025: Khushdil, Warner help Karachi Kings edge ...",https://www.dawn.com/news/1905780,"KARACHI: Under the blazing lights of the National Bank Stadium, an electric crowd — the largest so far in this HBL Pakistan Super League season — erupted as ...",Not Found,HBL_STRICT,2025,"April 22, 2025",SUCCESS
DAWN,"HBL PSL 2025: Hungry Karachi, Multan seek redemption ...",https://www.dawn.com/news/1903650,The HBL Pakistan Super League's tenth edition will arrive here at the National Bank Stadium on Saturday with a contest between two hungry sides in Karachi ...,Not Found,HBL_STRICT,2025,"April 12, 2025",SUCCESS
DAWN,HBL PSL 2025: Vince leads charge as Karachi Kings ...,https://www.dawn.com/news/1903883,It hardly looked like the venue was hosting its first match of the HBL Pakistan Super League's tenth edition. To make it worse for the home side Karachi ...,Not Found,HBL_STRICT,2025,"April 13, 2025",SUCCESS
DAWN,HBL PSL 2025: Irfan's late heroics stun Qalandars as Kings ...,https://www.dawn.com/news/1908497,Karachi Kings chased down a revised target of 168 in 14.3 overs to defeat Lahore Qalandars by four wickets in a rain-affected HBL Pakistan Super League match.,Not Found,HBL_STRICT,2025,"May 5, 2025",SUCCESS
DAWN,PSL matches to resume from May 17: PCB chairman - Sport,https://www.dawn.com/news/1910731,Pakistan Cricket Board (PCB) Chairman Mohsin Naqvi on Tuesday announced that the remaining eight matches of the HBL Pakistan Super League (PSL) — postponed ...,Not Found,HBL_STRICT,2025,"May 13, 2025",SUCCESS
DAWN,"Shakib, Rajapaksa join Lahore Qalandars; Karachi Kings ...",https://www.dawn.com/news/1911246,Former Bangladesh captain Shakib Al Hasan and Sri Lankan batter Bhanuka Rajapaksa have signed up for Lahore Qalandars for the remainder of the HBL Pakistan ...,Not Found,HBL_STRICT,2025,"May 16, 2025",SUCCESS
DAWN,Gender diversity awards - Newspaper,https://www.dawn.com/news/1940627,"This year's top winners include Engro Fertilizers, Engro Polymer & Chemicals, Pakistan Mobile Communications (Jazz), Habib Bank Limited (HBL), and English ...",Not Found,HBL_STRICT,2025,"September 9, 2025",SUCCESS
DAWN,Ravi Bopara appointed Karachi Kings head coach for PSL 10,https://www.dawn.com/news/1900997,"... HBL Pakistan Super League season 10. Bopara, a familiar face in the Karachi Kings camp, has been an integral part of the franchise over the years. Having ...",Not Found,HBL_STRICT,2025,"March 29, 2025",SUCCESS
DAWN,"Nestle, Unilever and PIA among 'happiest workplaces' in ...",https://www.dawn.com/news/1885143/nestle-unilever-and-pia-among-happiest-workplaces-in-pakistan-report,"... HBL Bank, Meezan Bank, Pakistan Petroleum, Jadeed and Factory X. The Pakistani workplaces that attained an overall happiness score of 95 per cent were ...",Not Found,HBL_STRICT,2025,"January 14, 2025",SUCCESS
DAWN,"Nestle, Unilever and PIA among 'happiest workplaces' in ...",https://www.dawn.com/news/1885143,"... HBL Bank, Meezan Bank, Pakistan Petroleum, Jadeed and Factory X. The Pakistani workplaces that attained an overall happiness score of 95 per cent were ...",Not Found,HBL_STRICT,2025,"January 14, 2025",SUCCESS
DAWN,'PSB's intervention in national federations will be subjective ...,https://www.dawn.com/news/1918647,"“Pakistan Hockey Federation is maintaining [an] account in Habib Bank Limited, Lahore, having enough funds for the said payment,” the letter said. “But as ...",Not Found,HBL_STRICT,2025,"June 21, 2025",SUCCESS
DAWN,"HBL PSL 2025 : Batters, Faheem give Quetta Gladiators ...",https://www.dawn.com/news/1906986,"HBL Pakistan Super League: Mitchell, Raza star as Qalandars deepen Sultans' woes ...",Not Found,HBL_STRICT,2025,"April 28, 2025",SUCCESS
DAWN,HBL PSL 2025: Quetta Gladiators upstage Islamabad ...,https://www.dawn.com/news/1908302,HBL Pakistan Super League: Raza stars as Qalandars end United's perfect run ...,Not Found,HBL_STRICT,2025,"May 4, 2025",SUCCESS
DAWN,Trading dollars for dragons - Newspaper,https://www.dawn.com/news/1954097,It has been reported that Pakistan's deal is supposed to be jointly led by arrangers and advisors from Habib Bank Limited (HBL) and China International Capital ...,Not Found,HBL_STRICT,2025,"November 10, 2025",SUCCESS
DAWN,HBL PSL 2025: Warner-inspired Karachi Kings upstage ...,https://www.dawn.com/news/1911673,"... HBL Pakistan Super League X resumed with a bang after a nine-day hiatus due to military clashes between India and Pakistan. But despite Babar's show, Zalmi ...",Not Found,HBL_STRICT,2025,"May 18, 2025",SUCCESS
DAWN,CRICKET: PSL AND THE NEXT DECADE - Newspaper,https://www.dawn.com/news/1929775,HBL Pakistan Super League: Quetta Gladiators' fightback floors Karachi Kings ...,Not Found,HBL_STRICT,2025,"August 10, 2025",SUCCESS
DAWN,UBL adjudged best at first Pakistan Banking Awards,http://www.dawn.com/news/1258421,"At the same time, Habib Bank Limited bagged two awards for the 'best bank for small business and agriculture' and the 'best Environmental, Social and Governance ...",Not Found,HBL_STRICT,2016,"May 15, 2016",SUCCESS
DAWN,"Gladiators, United clash for big prize in PSL final today",http://www.dawn.com/news/1241238,"After a 20-match long tournament, Islamabad United and Quetta Gladiators will meet in the final of the inaugural edition of the HBL Pakistan Super League (PSL)",Not Found,HBL_STRICT,2016,"February 23, 2016",SUCCESS
DAWN,My career is not over: Umar Gul,http://www.dawn.com/news/1251447,Gul had a fruitful first-class season with Habib Bank Limited before being dropped after Pakistan's ODI series defeat in Bangladesh in 2015. He made a ...,Not Found,HBL_STRICT,2016,"April 11, 2016",SUCCESS
DAWN,"Misbah, Azhar help SNGPL retain Quaid Trophy title",http://www.dawn.com/news/1231181,"SNGPL, who won the now defunct President's Trophy in both seasons they were held in 2012-13 and 2013-14 by defeating Habib Bank Limited and UBL respectively ...",Not Found,HBL_STRICT,2016,"January 7, 2016",SUCCESS
DAWN,Trendsetters Quetta Gladiators keep it modest and simple,https://www.dawn.com/news/1240022,The Gladiators were those 'outsiders' at the start of the inaugural edition of HBL Pakistan Super League. While other teams spoke of the Chris Gayle and the ...,Not Found,HBL_STRICT,2016,"February 17, 2016",SUCCESS
DAWN,The Navy jawaan who would be Adam Gilchrist - Newspaper,http://www.dawn.com/news/1290111,"... Habib Bank Limited. “When I was in the navy, I'd live inside the PNS Karsaz premises. After leaving service, I lodged with a friend in his apartment for two ...",Not Found,HBL_STRICT,2016,"October 16, 2016",SUCCESS
DAWN,Survivors of Regent Plaza fire share the horror - Pakistan,http://www.dawn.com/news/1300680,"Due to the fire incident at the hotel, the match between United Bank Limited and Habib Bank Limited of the Super Eight round of Quaid-i-Azam Trophy has also ...",Not Found,HBL_STRICT,2016,"December 6, 2016",SUCCESS
DAWN,HBL agrees to pay $225m fine - Pakistan,https://www.dawn.com/news/1356228,Bankers smell a rat in timing of HBL penalty · HBL earnings drop 2.5pc to Rs34.2bn. Comments (117) Closed. Popular Newest,Not Found,HBL_STRICT,2017,"September 8, 2017",SUCCESS
DAWN,Bankers smell a rat in timing of HBL penalty - Business,https://www.dawn.com/news/1355730,Bankers smell a rat in timing of HBL penalty ... Habib Bank Limited has voluntarily decided to wind up operations at its New York branch as the New York State ...,Not Found,HBL_STRICT,2017,"September 5, 2017",SUCCESS
DAWN,HBL profit drops 94pc after US penalty - Pakistan,https://www.dawn.com/news/1365137,Pakistan Governemnt should initiate criminal proceedings against the HBL bank for indulging in corrupt banking practices to show the world that they were not ...,Not Found,HBL_STRICT,2017,"October 21, 2017",SUCCESS
DAWN,HBL to close New York branch as US authorities seek ...,https://www.dawn.com/news/1354474,The Habib Bank Limited has on Monday announced its decision to wind up operations in New York following intimation from the state's financial regulator.,Not Found,HBL_STRICT,2017,"August 28, 2017",SUCCESS
DAWN,PSX ends week in green as KSE-100 gains 442 points,https://www.dawn.com/news/1356412,The market remained bearish over the past two sessions but a reduction in the penalty imposed on Habib Bank Limited (HBL) by New York regulators appeared to ...,Not Found,HBL_STRICT,2017,"September 8, 2017",SUCCESS
DAWN,Pakistan Stock Exchange becomes first self-listed ...,https://www.dawn.com/news/1342344,Two local financial institutions — the Pak-China Investment Company Limited and Habib Bank Limited — have been sold a 5pc share each. The PSX recently sold ...,Not Found,HBL_STRICT,2017,"June 30, 2017",SUCCESS
DAWN,HBL vows to fight charges levelled by US regulator - Pakistan,https://www.dawn.com/news/1354739,"If Habib Bank Limited (HBL) did not do anything wrong or did not break the law as its CEO has said, they must not worry. The American justice system is ...",Not Found,HBL_STRICT,2017,"August 30, 2017",SUCCESS
DAWN,Ruthless UBL inflict crushing defeat upon hapless HBL,https://www.dawn.com/news/1379811,"It seemed holders Habib Bank Limited (HBL) didn't want to turn up but once they did at the UBL Sports Complex, their demise was swift. United Bank Limited ...",Not Found,HBL_STRICT,2017,"December 31, 2017",SUCCESS
DAWN,Pakistan Stock Exchange closes above 50000 points,http://www.dawn.com/news/1310861,"... Habib Bank Limited. At least 17 entities in all had expressed an interest in the PSX, whose benchmark stock index was one of the best performing indices ...",Not Found,HBL_STRICT,2017,"January 26, 2017",SUCCESS
DAWN,"Banks charge up to 29pc interest rate, NA told - Pakistan",http://www.dawn.com/news/1312646,"Among the top tiers, the Habib Bank Limited charges 14.05pc markup and the MCB Bank 14pc. Interestingly, the country's largest bank owned by the government ...",Not Found,HBL_STRICT,2017,"February 4, 2017",SUCCESS
DAWN,'84pc of population lacks access to safe drinking water',https://www.dawn.com/news/1319157,"At the top is the Habib Bank Limited with a profit of Rs88bn, followed by MCB with Rs71bn, the United Bank Limited with Rs66bn and the Allied Bank Limited with ...",Not Found,HBL_STRICT,2017,"March 8, 2017",SUCCESS
DAWN,Rs10m stolen from 559 bank accounts in ATM fraud,https://www.dawn.com/news/1374623,"The Habib Bank Limited confirmed that over Rs10 million had been stolen from 559 of its accounts. Naveed Asghar, a corporate and marketing executive of the ...",Not Found,HBL_STRICT,2017,"December 5, 2017",SUCCESS
DAWN,Shan's century sets up comfortable win for UBL - Newspaper,https://www.dawn.com/news/1379366,"Elsewhere, Ahmed Shehzad led from the front with a sparkling undefeated 162 to help defending champions Habib Bank Limited (HBL) seal a five-wicket success ...",Not Found,HBL_STRICT,2017,"December 29, 2017",SUCCESS
DAWN,2017 in review: Dirty politics trumped development ...,https://www.dawn.com/news/1379546,"... Habib Bank Limited. The demutualisation, integration, and attraction of foreign strategic holding had been contemplated by SECP since 2002. It finally ...",Not Found,HBL_STRICT,2017,"December 29, 2017",SUCCESS
