source,title,url,snippet,published_date,query,year,extracted,extraction_status
DAWN,Pakistan approves $1.2 billion HBL divestment,http://www.dawn.com/news/1175302,"HBL, formerly known as Habib Bank Limited, was part-privatised in 2004, with the Agha Khan Foundation buying the bulk of the shares. The current offering is ...",Not Found,HBL_STRICT,2015,"April 11, 2015",SUCCESS
DAWN,Floor price for HBL divestment set at Rs166 per share,http://www.dawn.com/news/1174374,"... Habib Bank Limited (HBL). Privatisation Commission chairman Mohammad Zubair ... According to the approved offer for sale document (OFSD), the offer of HBL share ...",Not Found,HBL_STRICT,2015,"April 7, 2015",SUCCESS
DAWN,HBL in the spotlight - Business,http://www.dawn.com/news/1174129,"HBL's stock had dived from a high of Rs220.02 a share in January to Rs169.4 early last week; in fact, bank stocks, in general, had dropped from their recent ...",Not Found,HBL_STRICT,2015,"April 6, 2015",SUCCESS
DAWN,All-round growth in HBL's earnings,http://www.dawn.com/news/1216826,"All-round growth in HBL's earnings · Ali Raza Mehdi Published November 2, 2015.",Not Found,HBL_STRICT,2015,"November 2, 2015",SUCCESS
DAWN,NAB recovered Rs10m embezzled from HBL - Pakistan,http://www.dawn.com/news/1184891,The Balochistan region of National Accountability Bureau (NAB) has recovered Rs10 million embezzled by the officials of Habib Bank.,Not Found,HBL_STRICT,2015,"May 29, 2015",SUCCESS
DAWN,Karachi attracts highest bid as PSL teams sold for $93 million,http://www.dawn.com/news/1223992,"In another development, Habib Bank Limited ... As a result of this partnership, the league will now officially be known as the HBL Pakistan Super League.",Not Found,HBL_STRICT,2015,"December 3, 2015",SUCCESS
DAWN,Quaid-e-Azam Trophy: Imran Farhat to lead HBL after ...,http://www.dawn.com/news/1210441,"KARACHI: Pakistan's discarded opener Imran Farhat will lead the Habib Bank Limited (HBL) team in the Quaid-e-Azam Trophy, Sohail Mazhar, head of HBL sports ...",Not Found,HBL_STRICT,2015,"October 2, 2015",SUCCESS
DAWN,LDA sets ToRs of commission - Newspaper,http://www.dawn.com/news/1160589,"“They will have to deposit a fee of Rs5,000 for processing each case by the commission at the LDA's one window cell (HBL bank booth) by writing on the ...",Not Found,HBL_STRICT,2015,"January 31, 2015",SUCCESS
DAWN,"Gayle, Watson, Afridi, Pietersen lapped up in PSL player draft",http://www.dawn.com/news/1227890,"LAHORE: While Shahid Afridi, Misbah-ul-Haq along with Chris Gayle, Kevin Pietersen and Shane Watson were the big names that were selected at the HBL-Pakistan ...",Not Found,HBL_STRICT,2015,"December 22, 2015",SUCCESS
DAWN,'Pakistan is the highlight of my travels',https://www.dawn.com/news/1220377/pakistan-is-the-highlight-of-my-travels,"Karachi is the second stop of the pilot and the passenger, hosted here by Engro Corporation in collaboration with Habib Bank Limited and the Dawood ...",Not Found,HBL_STRICT,2015,"November 18, 2015",SUCCESS
DAWN,Four held by NAB for illegal allotment of plots - Newspaper,https://www.dawn.com/news/1196927/newspaper/column,... Habib Bank Limited and Azhar Zahid of Habib Metropolitan Bank and private citizen Muhammad Naseemuddin — were later arrested. “The accountability court has ...,Not Found,HBL_STRICT,2015,"July 29, 2015",SUCCESS
DAWN,"NAB arrests KP additional home sec, two others in Rs50 ...",https://www.dawn.com/news/1173676/nab-arrests-kp-additional-home-sec-two-others-in-rs50-millon-scam,"... Habib Bank Limited (HBL). Khan has been accused of using fake smart cards, the duplicates of those provided to IDPs, to withdraw large sums of money ...",Not Found,HBL_STRICT,2015,"April 3, 2015",SUCCESS
DAWN,HBL signs $500m pact with Chinese bank,http://www.dawn.com/news/1254414,"Habib Bank Limited (HBL) and the China Development Bank (CDB) signed on Monday a $500 million accord, the first such agreement between a Chinese and a ...",Not Found,HBL_STRICT,2016,"April 26, 2016",SUCCESS
DAWN,Habib Bank acquires 51pc FMFB shares - Business,http://www.dawn.com/news/1260627,Habib Bank Limited (HBL) said on Wednesday that it has acquired 51 per cent majority shareholding in the First Micro-Finance Bank Limited (FMFB).,Not Found,HBL_STRICT,2016,"May 26, 2016",SUCCESS
DAWN,HBL to become first South Asian lender to open branch in ...,http://www.dawn.com/news/1252890,"Habib Bank Limited is set to become the first South Asian lender to operate in the world's number two economy, after the bank announced on Monday that it has ...",Not Found,HBL_STRICT,2016,"April 18, 2016",SUCCESS
DAWN,"HBL on cusp of final, Wapda take control against SSGC",http://www.dawn.com/news/1300478,"At NBP Sports Complex, Karachi: HABIB BANK LIMITED 486 in 183.4 overs (Imran Farhat 133, Imam-ul-Haq 129, Abdur Rehman 58 not out, Mohammad Waqas 49, Azeem ...",Not Found,HBL_STRICT,2016,"December 5, 2016",SUCCESS
DAWN,PSX sells 40pc stake to Chinese consortium,http://www.dawn.com/news/1304006,Together they will take up 30pc of the strategic stock while two local financial institutions — Pak-China Investment Company Limited and Habib Bank Limited ...,Not Found,HBL_STRICT,2016,"December 23, 2016",SUCCESS
DAWN,Ton-up Rameez Aziz inspires HBL to thrilling victory,http://www.dawn.com/news/1233420,"Habib Bank Limited 308-8 in 49.3 overs (Rameez Aziz 122 not out, Imran Farhat 55, Hasan Raza Jr 36; Faraz Ahmed Khan 3-36, Adeel Malik 2-45).",Not Found,HBL_STRICT,2016,"January 17, 2016",SUCCESS
DAWN,"Imam, Imran inspire HBL, Kamran rescues Wapda",http://www.dawn.com/news/1300286,"At NBP Sports Complex, Karachi: HABIB BANK LIMITED 280-3 in 97 overs (Imam-ul-Haq 129, Imran Farhat 128 not out; Mir Hamza 2-41) vs UNITED BANK LIMITED. At UBL ...",Not Found,HBL_STRICT,2016,"December 4, 2016",SUCCESS
DAWN,"HBL, NBP, Wapda, KRL win as SSGC, SNGPL lose ...",https://www.dawn.com/news/1303687/hbl-nbp-wapda-krl-win-as-ssgc-sngpl-lose-unbeaten-run,"At UBL Sports Complex, Karachi: Habib Bank Limited beat United Bank Limited by 14 runs. HABIB BANK LIMITED 267 in 49 overs (Ahmed Shehzad 102, Rameez Aziz ...",Not Found,HBL_STRICT,2016,"December 22, 2016",SUCCESS
DAWN,"Asif, Malik star in big SSGC win; HBL beat Wapda",http://www.dawn.com/news/1302928,"At SBP Sports Complex, Karachi: Habib Bank Limited beat Water and Power Development Authority by six wickets. WATER AND POWER DEVELOPMENT AUTHORITY 161 in 49.5 ...",Not Found,HBL_STRICT,2016,"December 18, 2016",SUCCESS
DAWN,Chinese consortium wins 40pc stake bid in Pakistan Stock ...,https://www.dawn.com/news/1303869/chinese-consortium-wins-40pc-stake-bid-in-pakistan-stock-exchange,"... Habib Bank Limited. “The Divestment Committee will now issue the Letter of Acceptance to the above Consortium, subject to formal approval of Securities and ...",Not Found,HBL_STRICT,2016,"December 22, 2016",SUCCESS
DAWN,"Ahmed Shahzad fined Rs20,000 for misbehaving with umpire",http://www.dawn.com/news/1303647,... between Sui Northern Gas Pipelines Limited and Habib Bank Limited (HBL). Tap to unmute. Your browser can't play this video. Learn more. An error occurred.,Not Found,HBL_STRICT,2016,"December 21, 2016",SUCCESS
DAWN,Thar coal project achieves $2bn financial close after govt ...,http://www.dawn.com/news/1251498,"... Habib Bank Limited, China Machinery Engineering Corporation (CMEC) and State Power International Mendong (SPIM). This company will be responsible for ...",Not Found,HBL_STRICT,2016,"April 12, 2016",SUCCESS
DAWN,Salman Butt inspires Wapda to lift Quaid-i-Azam Trophy,http://www.dawn.com/news/1302537,"... Habib Bank Limited (HBL) culminated in a draw the National Stadium. Appropriately, it was the calming influence of skipper Salman Butt that played a ...",Not Found,HBL_STRICT,2016,"December 16, 2016",SUCCESS
DAWN,The 'incurious' case of ATM cash withdrawal - Pakistan,http://www.dawn.com/news/1250276,"... Habib Bank Limited, Samijabad Branch, with Account No 0447-0009894-01 and the bank issued him an automated teller machine card (No 421851086164001). He said ...",Not Found,HBL_STRICT,2016,"April 6, 2016",SUCCESS
DAWN,Islamabad United send Lahore Qalandars packing,http://www.dawn.com/news/1240432,"Islamabad United denied Lahore Qalandars a place in the HBL Pakistan Super League (PSL) play-offs, eliminating Azhar Ali's men from the competition.",Not Found,HBL_STRICT,2016,"February 19, 2016",SUCCESS
DAWN,Cantt board charging visitors 'illegal' parking fee - Newspaper,https://www.dawn.com/news/1256999,"The board has set up parking lots at Mall Plaza, Metro Plaza, Punjab Bank, National Bank at the Army Recruitment Centre, Habib Bank Limited parking, Nadra ...",Not Found,HBL_STRICT,2016,"May 8, 2016",SUCCESS
DAWN,"KW stutter, Kamran rescues Wapda as SBP venue makes ...",http://www.dawn.com/news/1297363,"... Habib Bank Limited (HBL) in a Group-II game that also brought together chief selector Inzamam-ul-Haq and two members of his committee, Tauseef Ahmed, Wasim ...",Not Found,HBL_STRICT,2016,"November 20, 2016",SUCCESS
DAWN,12 killed in fire at Karachi's Regent Plaza hotel - Pakistan,http://www.dawn.com/news/1300614,He said the UBL Quaid-i-Azam trophy match against Habib Bank Limited would be postponed today. Sixteen crew members of the Pakistan International Airlines ...,Not Found,HBL_STRICT,2016,"December 5, 2016",SUCCESS
DAWN,Quetta in quandary over availability of first-choice overseas ...,https://www.dawn.com/news/1395762/quetta-in-quandary-over-availability-of-first-choice-overseas-stars,"SHARJAH: Already assured of a playoff berth in the HBL Pakistan Super League, two-time losing finalists Quetta Gladiators now find themselves in a Catch-22 ...",Not Found,HBL_STRICT,2018,"March 17, 2018",SUCCESS
DAWN,Fakhar dazzles as Lahore come good,https://www.dawn.com/news/1395511,SHARJAH: Although there was nothing much at stake in Wednesday's HBL Pakistan Super League fixture except Quetta Gladiators trying to topple Islamabad ...,Not Found,HBL_STRICT,2018,"March 16, 2018",SUCCESS
DAWN,PCB suspends Umar Akmal from all cricket activities,https://www.dawn.com/news/1535598,Quetta Gladiators have replaced Akmal with Anwar Ali in the line-up for the HBL Pakistan Super League 2020 following the event's technical committee's approval.,Not Found,HBL_STRICT,2020,"February 20, 2020",SUCCESS
DAWN,Pindi ground staff's painstaking efforts bear fruit in gloomy ...,https://www.dawn.com/news/1539765,RAWALPINDI: The Rawalpindi leg of the HBL Pakistan Super League 2020 was an unqualified success in terms of attendance with the Pindi Cricket Stadium ...,Not Found,HBL_STRICT,2020,"March 10, 2020",SUCCESS
DAWN,Moeen-Shan stand too hot for Kings as Sultans romp home,https://www.dawn.com/news/1537309,"... HBL Pakistan Super League in a packed-to-capacity Multan Stadium here on Friday. Set to chase a target of 187, Kings though maintained a high run-rate but ...",Not Found,HBL_STRICT,2020,"February 29, 2020",SUCCESS
DAWN,8 banks being investigated in connection with exchange ...,https://www.dawn.com/news/1713447,"Bank Al Habib, Habib Bank Limited, National Bank of Pakistan (NBP), Meezan Bank Limited, United Bank Limited (UBL), Allied Bank Limited (ABL) and Standard ...",Not Found,HBL_STRICT,2022,"October 4, 2022",SUCCESS
DAWN,PSL 7: Franchises boost teams with supplementary and ...,https://www.dawn.com/news/1668346,The six HBL Pakistan Super League (PSL) franchises on Saturday picked additional players and submitted partial replacements for unavailable players in a ...,Not Found,HBL_STRICT,2022,"January 8, 2022",SUCCESS
DAWN,HBL Pakistan Super League: Record-breaking Rossouw ...,https://www.dawn.com/news/1741570,"HBL Pakistan Super League: Record-breaking Rossouw lifts Sultans into playoffs. Kashif Abbasi. Published March 11, 2023.",Not Found,HBL_STRICT,2023,"March 11, 2023",SUCCESS
DAWN,Afghan refugees get $18m cash under UN's programme,https://www.dawn.com/news/1764253,"She also acknowledged and appreciated the support in its implementation by the government of Pakistan, financial service provider Habib Bank Limited and ...",Not Found,HBL_STRICT,2023,"July 12, 2023",SUCCESS
DAWN,Hyderabad's Niaz Stadium longs for revival of cricket ...,https://www.dawn.com/news/1736462,HYDERABAD: As the glitz and glamour of the HBL Pakistan Super League returns for an eighth edition from next week with hi-octane action across four venues ...,Not Found,HBL_STRICT,2023,"February 11, 2023",SUCCESS
DAWN,Meezan declared 'best bank' for second consecutive year,https://www.dawn.com/news/1875710,"Habib Bank Limited was awarded “Best Bank for SMEs”, while the Mobilink Microfinance Bank was given the “Best Micro Finance Bank” award. The National ...",Not Found,HBL_STRICT,2024,"November 30, 2024",SUCCESS
DAWN,HBL PSL 2025: Skipper Babar steers Peshawar Zalmi to ...,https://www.dawn.com/news/1906412,"... HBL Pakistan Super League season on Thursday. Zalmi's four-pronged pace attack had laid the platform after they tore into the Qalandars line-up, reducing ...",Not Found,HBL_STRICT,2025,"April 25, 2025",SUCCESS
DAWN,HBL PSL 2025: All-round Shadab stars as United rout ...,https://www.dawn.com/news/1912054,"RAWALPINDI: Having lost four matches in a row following five wins on the trot to open their HBL Pakistan Super League campaign, Islamabad United arrived ...",Not Found,HBL_STRICT,2025,"May 20, 2025",SUCCESS
DAWN,Shaheen named captain of Pakistan Super League X team,https://www.dawn.com/news/1913527,"... HBL Pakistan Super League X team announced by the Pakistan Cricket Board (PCB) on Monday. Fast bowler Shaheen Shah Afridi, the captain of victorious Lahore ...",Not Found,HBL_STRICT,2025,"May 27, 2025",SUCCESS
DAWN,Ranjan Madugalle to make PSL debut as match referee,https://www.dawn.com/news/1670318,ICC's chief match referee Ranjan Madugalle will make his HBL Pakistan Super League debut when he officiates at the seventh edition of PCB's marquee event.,Not Found,HBL_STRICT,2022,"January 19, 2022",SUCCESS
DAWN,"Cutting, Tanvir fined 15pc match fees for using 'offensive' ...",https://www.dawn.com/news/1675419,"HBL Pakistan Super League: Sarfraz finally strikes form, leads ...",Not Found,HBL_STRICT,2022,"February 16, 2022",SUCCESS
DAWN,Lahore Qalandars become champions of PSL for the first time,https://www.dawn.com/news/1677379,HBL Pakistan Super League: Supreme Qalandars snap Sultans' winning streak.,Not Found,HBL_STRICT,2022,"February 27, 2022",SUCCESS
DAWN,Babar eyes clean sweep against 'dangerous' WI in ...,https://www.dawn.com/news/1692634,Both the players due to injuries missed the home series against Australia as well as some matches of the last HBL Pakistan Super League. “Shadab and Nawaz ...,Not Found,HBL_STRICT,2022,"June 2, 2022",SUCCESS
DAWN,HBL Pakistan Super League: Guptill-inspired Gladiators ...,https://www.dawn.com/news/1740789,"HBL Pakistan Super League: Guptill-inspired Gladiators stay alive with thrilling victory over Kings · Kashif Abbasi Published March 7, 2023. 0.",Not Found,HBL_STRICT,2023,"March 7, 2023",SUCCESS
DAWN,"HBL Pakistan Super League: Ihsan, Rossouw power ...",https://www.dawn.com/news/1737317,"HBL Pakistan Super League: Ihsan, Rossouw power Sultans to crushing win over Gladiators · Monitoring Desk Published February 16, 2023. 0.",Not Found,HBL_STRICT,2023,"February 16, 2023",SUCCESS
DAWN,"HBL Pakistan Super League: Aamer, Salman pace show ...",https://www.dawn.com/news/1742581,"HBL Pakistan Super League: Aamer, Salman pace show helps Zalmi eliminate United · Mohammad Yaqoob Published March 17, 2023. 0.",Not Found,HBL_STRICT,2023,"March 17, 2023",SUCCESS
DAWN,HBL Pakistan Super League: Record-smashing Usman ...,https://www.dawn.com/news/1741697,HBL Pakistan Super League: Record-smashing Usman extinguishes Gladiators' playoff hopes ... He can be found on X at @AbbasiKashif833. Kashif Abbasi. Read more ...,Not Found,HBL_STRICT,2023,"March 12, 2023",SUCCESS
DAWN,'Sab sitarey' descend in Multan as PSL 8 officially kicks off ...,https://www.dawn.com/news/1736932,"Speaking at the ceremony, Habib Bank Limited (HBL) ... Into its eighth season, the HBL Pakistan Super League is set to operate at its maximum potential.",Not Found,HBL_STRICT,2023,"February 13, 2023",SUCCESS
DAWN,PSL 8: Shaheen's Lahore restore pride in 63-run thrashing ...,https://www.dawn.com/news/1738371,"For the defending champions' persona that represents passion and expression, getting battered by Karachi Kings in a box office HBL Pakistan Super League (PSL) ...",Not Found,HBL_STRICT,2023,"February 21, 2023",SUCCESS
DAWN,Haris credits Babar for his success as Pakistan mainstay,https://www.dawn.com/news/1740552,"After all, he had done it all his life with the tape ball and replicated the ability at HBL Pakistan Super League franchise Lahore Qalandars' trials. But ...",Not Found,HBL_STRICT,2023,"March 6, 2023",SUCCESS
DAWN,"Shaheen's cameo proved turning point of the final, says ...",https://www.dawn.com/news/1743072,LAHORE: Both Shaheen Shah Afridi and Mohammad Rizwan heaped praise on each other following the nerve-racking final of the HBL Pakistan Super League here at ...,Not Found,HBL_STRICT,2023,"March 20, 2023",SUCCESS
DAWN,"Gurbaz fireworks, fiery Hasan see Islamabad United ...",https://www.dawn.com/news/1738739,It seemed as if the Afghanistan opener was celebrating being back at the HBL Pakistan Super League (PSL) after fulfilling national duty. The explosive right ...,Not Found,HBL_STRICT,2023,"February 23, 2023",SUCCESS
DAWN,Iftikhar Ahmed dazzles as Gladiators edge Zalmi in PSL ...,https://www.dawn.com/news/1735489,"... HBL Pakistan Super League exhibition match between Quetta Gladiators and Peshawar Zalmi here on Sunday. The stadium's capacity of 20,000 spectators wasn't ...",Not Found,HBL_STRICT,2023,"February 6, 2023",SUCCESS
DAWN,PSL 2023: Multan ruthlessly expose Lahore's weaknesses ...,https://www.dawn.com/news/1742490,HBL Pakistan Super League: Intriguing battle in store as ...,Not Found,HBL_STRICT,2023,"March 16, 2023",SUCCESS
DAWN,Plight of stranded Pakistanis in Dhaka and billions ...,https://www.dawn.com/news/1798514,"However, that process was stopped and the fund of millions of rupees — now in the Habib Bank Limited and has multiplied over the years into billions of rupees — ...",Not Found,HBL_STRICT,2023,"December 17, 2023",SUCCESS
DAWN,Shadab says Pakistan achieved their objectives in ...,https://www.dawn.com/news/1744692,... HBL Pakistan Super League — where easier conditions were at play — according to Shadab's admission. “I think we assessed the conditions better [in the third ...,Not Found,HBL_STRICT,2023,"March 29, 2023",SUCCESS
DAWN,Confident Saim wants to create his own legacy - Sport,https://www.dawn.com/news/1746438,"... HBL Pakistan Super League earlier this year, scoring 341 runs at an excellent strike rate of 165.33. His performance in the PSL earned him a place in ...",Not Found,HBL_STRICT,2023,"April 8, 2023",SUCCESS
DAWN,PSL 2024: Gauging the strengths and weaknesses of ...,https://www.dawn.com/news/1814404,HBL Pakistan Super League: Trophy unveiling stirs excitement ...,Not Found,HBL_STRICT,2024,"February 17, 2024",SUCCESS
DAWN,Lahore Qalandars get Mitchell for PSL 10,https://www.dawn.com/news/1885002,LAHORE: All six franchises of the HBL Pakistan Super League completed their respective squads for the 10th edition during the players' draft ceremony held ...,Not Found,HBL_STRICT,2025,"January 14, 2025",SUCCESS
DAWN,Australia's Warner named Karachi Kings captain - Sport,https://www.dawn.com/news/1900144,Former Australian opener David Warner has been appointed as the captain of HBL Pakistan Super League side Karachi Kings.,Not Found,HBL_STRICT,2025,"March 25, 2025",SUCCESS
DAWN,Tensions hit cricket leagues on both sides of the border,https://www.dawn.com/news/1909898,"KARACHI: Hours after deciding to shift the HBL Pakistan Super (PSL) to the United Arab Emirates, the Pakistan Cricket Board (PCB) postponed the remaining ...",Not Found,HBL_STRICT,2025,"May 10, 2025",SUCCESS
DAWN,"HBL PSL: Amid uncertainty off the pitch, Qalandars and ...",https://www.dawn.com/news/1739197,... HBL Pakistan Super League match at the National Stadium on Tuesday. — AFP ... HBL Pakistan Super League match at the National Stadium on Tuesday. — AFP.,Not Found,HBL_STRICT,2023,"February 26, 2023",SUCCESS
DAWN,Startup AdalFi raises $7.5 million in seed funding - Business,https://www.dawn.com/news/1737468,"The company has signed on 14 banks, including United Bank Limited (UBL), Habib Bank Limited (HBL), Meezan Bank, among other banks and microfinance banks ...",Not Found,HBL_STRICT,2023,"February 16, 2023",SUCCESS
DAWN,PSL 8: Tabraiz Shamsi bamboozles Sultans to give Kings ...,https://www.dawn.com/news/1739251,"No one knew whether it was Karachi Kings' last HBL Pakistan Super League match of the season on their home turf at the National Stadium on Sunday, ...",Not Found,HBL_STRICT,2023,"February 26, 2023",SUCCESS
DAWN,Imad Wasim's all-round show against Lahore lights up ...,https://www.dawn.com/news/1738011,"For hosts Karachi Kings, the lights seemed to be those that would illuminate their prospects at the HBL Pakistan Super League (PSL), which had looked dark ahead ...",Not Found,HBL_STRICT,2023,"February 19, 2023",SUCCESS
DAWN,Working to improve my bowling: Ihsanullah - Sport,https://www.dawn.com/news/1746601,"Similarly, I am trying to further improve my yorkers,” Ihsanullah, who bowled the fastest delivery of HBL Pakistan Super League earlier this year while ...",Not Found,HBL_STRICT,2023,"April 9, 2023",SUCCESS
DAWN,HBL PSL: Shaheen-inspired Qalandars are champions again,https://www.dawn.com/news/1742890,HBL Pakistan Super League: Qalandars upstage Zalmi to set up ...,Not Found,HBL_STRICT,2023,"March 19, 2023",SUCCESS
DAWN,"Mickey Arthur set to return as Pakistan coach, hints Sethi",https://www.dawn.com/news/1733245,... HBL Pakistan Super League. Pakistan will also feature in the Asia Cup in September and are scheduled to play two Tests in Sri Lanka in July. “One of the key ...,Not Found,HBL_STRICT,2023,"January 24, 2023",SUCCESS
DAWN,Wahab Riaz announces retirement from international cricket,https://www.dawn.com/news/1770444,HBL Pakistan Super League: Passionate Wahab Riaz not giving up on ...,Not Found,HBL_STRICT,2023,"August 16, 2023",SUCCESS
DAWN,Lahore Qalandars make history by defending PSL title in ...,https://www.dawn.com/news/1742886,HBL Pakistan Super League: Qalandars upstage Zalmi to set up ...,Not Found,HBL_STRICT,2023,"March 18, 2023",SUCCESS
DAWN,Zaman eyes opportunities to win matches for Pakistan - Sport,https://www.dawn.com/news/1746818,"The slingy pacer, who has consistently shined in death overs in domestic cricket and the HBL Pakistan Super League over the past two to three years, however ...",Not Found,HBL_STRICT,2023,"April 10, 2023",SUCCESS
DAWN,CRICKET: SOLID SALMAN AT THE CREASE - Newspaper,https://www.dawn.com/news/1756378,"When almost all his Pakistan teammates were playing in the HBL Pakistan Super League (PSL) a few months ago, he was watching them on TV at home. “The PSL's ...",Not Found,HBL_STRICT,2023,"May 28, 2023",SUCCESS
DAWN,"Complex teaching problems can't be fixed by pay rises, ...",https://www.dawn.com/news/1735222,"Mohammad Ali Tabba, Chief Executive Officer of Lucky Cement Ltd, and Chairman of Habib Bank Limited Sultan Ali Allana also spoke. Published in Dawn ...",Not Found,HBL_STRICT,2023,"February 4, 2023",SUCCESS
DAWN,"HBL PSL 2024: Rizwan, Iftikhar lift Sultans past Qalandars",https://www.dawn.com/news/1816079,"Led by their pugnacious captain Mohammad Rizwan, the Sultans kept their perfect start to the HBL Pakistan Super League season intact when they downed the ...",Not Found,HBL_STRICT,2024,"February 22, 2024",SUCCESS
DAWN,Cricket: PSL X: A tournament to remember,https://www.dawn.com/news/1914474,"This season ends the ten-year agreement establishing the Pakistan Super League with six teams, with HBL Pakistan as the primary sponsor, and with the ...",Not Found,HBL_STRICT,2025,"May 31, 2025",SUCCESS
DAWN,Fans still face arduous trek to National Stadium for PSL ...,https://www.dawn.com/news/1739195,1 on the ticket for the HBL Pakistan Super League encounter between Islamabad United and Quetta Gladiators. And although barely one-third of the venue was ...,Not Found,HBL_STRICT,2023,"February 26, 2023",SUCCESS
DAWN,Usama Mir looking to reap rewards of decade-long struggle,https://www.dawn.com/news/1739619,Things turned around for the right-armer after he spent time training at HBL Pakistan Super League franchise Lahore Qalandars' High-Performance Centre ...,Not Found,HBL_STRICT,2023,"March 1, 2023",SUCCESS
DAWN,Ramazan events continue to serve as Pakistan cricket's ...,https://www.dawn.com/news/1746452,"... HBL Pakistan Super League, in which a more than impressive show earned him a called up in the Pakistan squad for the recent three-match T20 International ...",Not Found,HBL_STRICT,2023,"April 8, 2023",SUCCESS
DAWN,PML-N's Miftah decries Pakistan's lack of progress under ...,https://www.dawn.com/news/1738010,"The panel also featured Habib Bank Limited (HBL) CEO Muhammad Aurangzeb, Institute of Business Administration (IBA) Karachi Executive Director Akbar Zaidi ...",Not Found,HBL_STRICT,2023,"February 19, 2023",SUCCESS
DAWN,Naseem reflects on the day he felt his father was right - Sport,https://www.dawn.com/news/1736153,"The pacer will be next seen in action in the upcoming edition of the HBL Pakistan Super League, in which he will lead the Quetta Gladiators attack. When the ...",Not Found,HBL_STRICT,2023,"February 9, 2023",SUCCESS
DAWN,Plan finalised to ease traffic movement during PSL ...,https://www.dawn.com/news/1737113,HBL Pakistan Super League: Qalandars edge Sultans by one run in last-ball ...,Not Found,HBL_STRICT,2023,"February 14, 2023",SUCCESS
